title,text,subject,date
U.S. appeals court rejects challenge to Trump voter fraud panel,"(Reuters) - A U.S. appeals court in Washington on Tuesday upheld a lower court’s decision to allow President Donald Trump’s commission investigating voter fraud to request data on voter rolls from U.S. states. The U.S. Court of Appeals for the District of Columbia Circuit said the Electronic Privacy Information Center (EPIC) watchdog group, which filed the lawsuit, did not have legal standing to seek to force the presidential commission to review privacy concerns before collecting individuals’ voter data. EPIC had argued that under federal law, the commission was required to conduct a privacy-impact assessment before gathering personal data. But the three-judge appeals court panel ruled unanimously that the privacy law at issue was intended to protect individuals, not groups like EPIC. “EPIC is not a voter,” Judge Karen Henderson wrote in the ruling.  Washington-based U.S. District Judge Colleen Kollar-Kotelly first denied EPIC’s injunction request in July, in part because the collection of data by the commission was not technically an action by a government agency so was not bound by laws that govern what such entities can do.  Kollar-Kotelly noted that the commission, headed by Vice President Mike Pence, was an advisory body that lacks legal authority to compel states to hand over the data. Most state officials who oversee elections and election law experts say that voter fraud is rare in the United States. Trump, a Republican, set up the commission in May after charging, without evidence, that millions of people voted unlawfully in the 2016 presidential election in which he defeated Democratic opponent Hillary Clinton despite losing the popular vote.  The commission’s vice chair, Kris Kobach, the Republican secretary of state for Kansas and an advocate of tougher laws on immigration and voter identification, asked states in June to turn over voter information. The data requested by Kobach included names, the last four digits of Social Security numbers, addresses, birth dates, political affiliation, felony convictions and voting histories.  More than 20 states refused outright and others said they needed to study whether they could provide the data. Civil rights groups and Democratic lawmakers have said the commission’s eventual findings could lead to new ID requirements and other measures making it harder for groups that tend to favor Democratic candidates to cast ballots. EPIC executive director Marc Rotenberg could not immediately be reached for comment. ",politicsNews,"December 26, 2017 "
Treasury Secretary Mnuchin was sent gift-wrapped box of horse manure: reports,"(Reuters) - A gift-wrapped package addressed to U.S. Treasury Secretary Steven Mnuchin’s home in a posh Los Angeles neighborhood that was suspected of being a bomb was instead filled with horse manure, police told local media. The package was found Saturday evening in a next-door neighbor’s driveway in Bel Air, the Los Angeles Police Department told the Los Angeles Times and KNBC television, the NBC affiliate in Los Angeles. The package also included a Christmas card with negative comments about President Donald Trump and the new U.S. tax law signed by Trump last week. Reuters could not reach LAPD officials for comment on Sunday. An LAPD bomb squad X-rayed the package before opening it and found the horse manure inside, police told local media. Aerial footage from KNBC showed officers investigating a large box in wrapping paper, then dumping a large amount of what they later identified as the manure and opening the card that was included inside.  Mnuchin, who KNBC said was not home when the package was discovered, is a former Goldman Sachs Group Inc executive and Hollywood film financier. A road in Bel Air was closed for about two hours, KNBC reported. The U.S. Secret Service is also investigating the incident, according to the TV station. ",politicsNews,"December 24, 2017 "
Federal judge partially lifts Trump's latest refugee restrictions,"WASHINGTON (Reuters) - A federal judge in Seattle partially blocked U.S. President Donald Trump’s newest restrictions on refugee admissions on Saturday, the latest legal defeat for his efforts to curtail immigration and travel to the United States. The decision by U.S. District Judge James Robart is the first judicial curb on rules the Trump administration put into place in late October that have contributed significantly to a precipitous drop in the number of refugees being admitted into the country. Refugees and groups that assist them argued in court that the administration’s policies violated the Constitution and federal rulemaking procedures, among other claims. Department of Justice attorneys argued in part that U.S. law grants the executive branch the authority to limit refugee admissions in the way that it had done so. On Oct. 24, the Trump administration effectively paused refugee admissions from 11 countries mostly in the Middle East and Africa, pending a 90-day security review, which was set to expire in late January. The countries subject to the review are Egypt, Iran, Iraq, Libya, Mali, North Korea, Somalia, South Sudan, Sudan, Syria and Yemen. For each of the last three years, refugees from the 11 countries made up more than 40 percent of U.S. admissions. A Reuters review of State Department data showed that as the review went into effect, refugee admissions from the 11 countries plummeted. Robart ruled that the administration could carry out the security review, but that it could not stop processing or admitting refugees from the 11 countries in the meantime, as long as those refugees have a “bona fide” connection to the United States. As part of its new restrictions, the Trump administration had also paused a program that allowed for family reunification for refugees, pending further security screening procedures being put into place. Robart ordered the government to re-start the program, known as “follow-to-join”. Approximately 2,000 refugees were admitted into the United States in fiscal year 2015 under the program, according to Department of Homeland Security data. Refugee advocacy groups praised Robart’s decision.  “This ruling brings relief to thousands of refugees in precarious situations in the Middle East and East Africa, as well as to refugees already in the U.S. who are trying to reunite with their spouses and children,” said Mariko Hirose, litigation director for the International Refugee Assistance Project, one of the plaintiffs in the case. A Justice Department spokeswoman, Lauren Ehrsam, said the department disagrees with Robart’s ruling and is “currently evaluating the next steps”. Robart, who was appointed to the bench by Republican former President George W. Bush, emerged from relative obscurity in February, when he issued a temporary order to lift the first version of Trump’s travel ban. On Twitter, Trump called him a “so-called judge” whose “ridiculous” opinion “essentially takes law-enforcement away from our country”. Robart’s ruling represented the second legal defeat in two days for the Trump administration. On Friday, a U.S. appeals court said Trump’s travel ban targeting six Muslim-majority countries should not be applied to people with strong U.S. ties, but said its ruling would be put on hold pending a decision by the U.S. Supreme Court. ",politicsNews,"December 24, 2017 "
Exclusive: U.S. memo weakens guidelines for protecting immigrant children in court,"NEW YORK (Reuters) - The U.S. Justice Department has issued new guidelines for immigration judges that remove some instructions for how to protect unaccompanied juveniles appearing in their courtrooms. A Dec. 20 memo, issued by the Executive Office for Immigration Review (EOIR) replaces 2007 guidelines, spelling out policies and procedures judges should follow in dealing with children who crossed the border illegally alone and face possible deportation.  The new memo removes suggestions contained in the 2007 memo for how to conduct “child-sensitive questioning” and adds reminders to judges to maintain “impartiality” even though “juvenile cases may present sympathetic allegations.” The new document also changes the word “child” to “unmarried individual under the age of 18” in many instances. (Link to comparison: tmsnrt.rs/2BlT0VK May 2007 document: tmsnrt.rs/2BBR8wj December 2017 document: tmsnrt.rs/2C2sWCs)  An EOIR official said the new memo contained “clarifications and updates” to 10-year-old guidance “in order to be consistent with the laws as they’ve been passed by Congress.” The new memo was posted on the Justice Department website but has not been previously reported.  Immigration advocates said they worry the new guidelines could make court appearances for children more difficult, and a spokeswoman for the union representing immigration judges said judges are concerned about the tone of the memo. President Donald Trump has made tougher immigration enforcement a key policy goal of his administration, and has focused particularly on trying to curb the illegal entry of children. The administration says it wants to prevent vulnerable juveniles from making perilous journeys to the United States and eliminate fraud from programs for young immigrants.  One changed section of the memo focuses on how to make children comfortable in the court in advance of hearings. The old guidance says they “should be permitted to explore” courtrooms and allowed to “sit in all locations, (including, especially, the judge’s bench and the witness stand).”  The new guidance says such explorations should take place only “to the extent that resources and time permit” and specifically puts the judge’s bench off limits. The new memo also warns judges to be skeptical, since an unaccompanied minor “generally receives more favorable treatment under the law than other categories of illegal aliens,” which creates “an incentive to misrepresent accompaniment status or age in order to attempt to qualify for the benefits.” It also says to be on the lookout for “fraud and abuse,” language that was not in the previous memo. Immigration judges are appointed by the U.S. Attorney General and courts are part of the Department of Justice, not an independent branch. The only sitting immigration judges routinely allowed to speak to the media are representatives of their union, the National Association of Immigration Judges.  Dana Marks, a sitting judge and spokeswoman for the union, said the “overall tone” of the memo “is very distressing and concerning to immigration judges.”  “There is a feeling that the immigration courts are just being demoted into immigration enforcement offices, rather than neutral arbiters,” Marks said. “There has been a relentless beating of the drum toward enforcement rather than due process.”   Former immigration judge Andrew Arthur, who now works at the Center for Immigration Studies, which promotes lower levels of immigration overall, said the new guidelines were needed.  In their previous form, he said, “so much emphasis was placed on the potential inability of the alien to understand the proceedings ... that it almost put the judge into the position of being an advocate.”   The courts have had to handle a surge in cases for unaccompanied minors, mostly from Central America, after their numbers sky-rocketed in 2014 as violence in the region caused residents to flee north.  While illegal crossings initially fell after Trump took office, U.S. Customs and Border Protection said that since May, each month has seen an increase in children being apprehended either alone or with family members.  Attorney General Jeff Sessions said in a speech in Boston in September that the special accommodations for unaccompanied minors had been exploited by “gang members who come to this country as wolves in sheep clothing.” Echoing some of these concerns, the new memo notes in a preamble that not all child cases involve innocents, and that the courts might see “an adolescent gang member” or “a teenager convicted as an adult for serious criminal activity.”  Jennifer Podkul, policy director of Kids in Need of Defense (KIND) said Congress included special procedural protections for immigrant children in a 2008 anti-trafficking bill to “make sure that a kid gets a fair shot in the courtroom.” “These kids are by themselves telling a very complicated and oftentimes very traumatic story,” said Podkul. “The approach of this memo, which is much more suspicious, is not going to help get to the truth of a child’s story.”  In cases where children are called to testify, the old guidance instructed judges to “seek to limit the amount of time the child is on the stand.” The new guidance says that judges should “consider” limiting the child’s time on the stand “without compromising due process for the opposing party,” which is generally a government prosecutor. The memo leaves in a range of special accommodations made for children, including allowing them to bring a pillow or booster seat or a “toy, book, or other personal item.” It also maintains that cases involving unaccompanied minors should be heard on a separate docket when possible and that children should not be detained or transported with adults. ",politicsNews,"December 23, 2017 "
Trump travel ban should not apply to people with strong U.S. ties: court,"(Reuters) - A U.S. appeals court on Friday said President Donald Trump’s hotly contested travel ban targeting people from six Muslim-majority countries should not be applied to people with strong U.S. ties. The 9th U.S. Circuit Court of Appeals, which covers several West Coast states, also said its ruling would be put on hold pending a decision on the latest version of the travel ban from the Trump administration by the U.S. Supreme Court. Since taking office in January, Trump has been struggling to enact a ban that passes court muster. A three-judge panel from the 9th Circuit narrowed a previous injunction from a lower federal court to those people “with a credible bona fide relationship with the United States.” It also said that while the U.S. president has broad powers to regulate the entry of immigrants into the United States, those powers are not without limits. “We conclude that the President’s issuance of the Proclamation once again exceeds the scope of his delegated authority,” the panel said. The ban targets people from Chad, Iran, Libya, Somalia, Syria and Yemen seeking to enter the United States. Trump, a Republican, has said the travel ban is needed to protect the United States from terrorism. The state of Hawaii, however, challenged it in court, and a Honolulu federal judge said it exceeded Trump’s powers under immigration law. Trump’s ban also covers people from North Korea and certain government officials from Venezuela, but the lower courts had already allowed those provisions to go into effect. The same three-judge 9th Circuit panel, which limited a previous version of Trump’s ban, heard arguments earlier this month. Trump issued his first travel ban targeting several Muslim-majority countries in January, which caused chaos at airports and mass protests. He issued a revised one in March after the first was blocked by federal courts. That expired in September after a court fight and was replaced with the current version. The ban has some exceptions. Certain people from each targeted country can still apply for a visa for tourism, business or education purposes, and applicants can ask for an individual waiver. “We are pleased that the Supreme Court has already allowed the government to implement the proclamation and keep all Americans safe while this matter is litigated. We continue to believe that the order should be allowed to take effect in its entirety,” U.S. Justice Department spokeswoman Lauren Ehrsam said in a statement. ",politicsNews,"December 23, 2017 "
Second court rejects Trump bid to stop transgender military recruits,"WASHINGTON (Reuters) - A federal appeals court in Washington on Friday rejected a bid by President Donald Trump’s administration to prevent the U.S. military from accepting transgender recruits starting Jan. 1, the second court to issue such a ruling this week. Four federal judges around the country have issued injunctions blocking Trump’s ban on transgender people from the military, including one that was also handed down on Friday. The administration has appealed the previous three rulings. In a six-page order, the three-judge-panel of the U.S. Court of Appeals for the District of Columbia Circuit said the administration had “not shown a strong likelihood that they will succeed on the merits of their challenge” to a district court’s order blocking the ban. On Thursday the Richmond, Virginia-based 4th U.S. Circuit Court of Appeals said it was denying the administration’s request while the appeal proceeds. The two courts’ actions could prompt the administration to ask the conservative-majority U.S. Supreme Court to intervene. Also on Friday, a federal trial court in Riverside, California, blocked the ban while the case proceeds, making it the fourth to do so, after similar rulings in Baltimore, Seattle and Washington, D.C. U.S. District Judge Jesus Bernal said without the injunction the plaintiffs, including current and aspiring service members, would suffer irreparable harm. “There is nothing any court can do to remedy a government-sent message that some citizens are not worthy of the military uniform simply because of their gender,” he added. The administration had argued that the Jan. 1 deadline for accepting transgender recruits was problematic because tens of thousands of personnel would have to be trained on the medical standards needed to process transgender applicants, and the military was not ready for that. The Obama administration had set a deadline of July 1, 2017, to begin accepting transgender recruits, but Trump’s defense secretary, James Mattis, postponed that date to Jan. 1. In an August memorandum, Trump gave the military until March 2018 to revert to a policy prohibiting openly transgender individuals from joining the military and authorizing their discharge. The memo also halted the use of government funds for sex-reassignment surgery for active-duty personnel. ",politicsNews,"December 23, 2017 "
Failed vote to oust president shakes up Peru's politics,"LIMA (Reuters) - Peru’s President Pedro Pablo Kuczynski could end up the surprise winner of an attempt to oust him from power this week, after some opposition lawmakers broke ranks with party leaders to support him, opening a divide that might strengthen his hand. Despite having a Congressional majority, the rightwing opposition party Popular Force was unable to push through a motion to remove Kuczynski from office on Thursday, after 10 of its own lawmakers broke ranks to save the president. The vote cemented a growing divide in the opposition and looked to threaten its control over Congress, potentially aiding Kuczynski as he tries to restore political stability and revive investments in one of Latin America’s most robust economies. The surprise defection was the result of a deal struck between Kuczynski and Popular Force rebel lawmaker Kenji Fujimori to get his father and ex-president Alberto Fujimori out of prison, alleged Popular Force secretary general, Jose Chlimper. Over the past year, Kenji has courted Kuczynski’s center-right government while challenging his sister Keiko’s leadership of the rightwing populist movement that their father formed in the 1990s. In defiance of his sister, Kenji threw his support behind Kuczynski ahead of the vote on whether to remove him from office over unproven graft allegations. Nine other Popular Force lawmakers followed his lead. “This is the birth of a serious and formal split (in the Fujimori movement),” said Guillermo Loli, the head of political research for pollster Ipsos Peru. “Everything points to a pardon,” he added.     Kuczynski’s government denied that a pardon for Fujimori was part of its political negotiations. In an address to the nation late on Friday, Kuczynski said he would spend the coming days reflecting on his year and a half in office. “I’ll be announcing to you changes to make sure 2018 is not just a year of greater growth, but politically different,” Kuczynski said. Efforts to reach the Popular Force lawmakers who defected were not successful. One, Clayton Galvan, said on local TV channel Canal N that Alberto Fujimori called them from prison to ask them to help Kuczynski stay in power.     Alberto Fujimori, who is serving a 25-year sentence for graft and human rights crimes, is a deeply divisive figure in Peru. While many consider him a corrupt dictator, others credit him with ending an economic crisis and bloody leftist insurgency during his 1990-2000 term. Freeing him would likely anger the well-organized foes of the Fujimori clan - a mix of technocrats, leftists, human rights activists and academics. “The day (Kuczynski) signs a pardon, he loses all of those guys. Permanently,” said Harvard University political scientist Steve Levitsky. Support from the anti-Fujimori crowd was key to Kuczynski’s razor-thin victory over Keiko in last year’s presidential election, and to keeping the motion to oust him from succeeding. “Kuczynski was saved by two diametrically opposed political groups: Kenji’s group and the left, which opposes a pardon. He can’t please both of them,” said Levitsky. Kuczynski, a 79-year-old former investment banker, took office amid hopes he would usher in cleaner government and faster economic growth. Instead, a graft scandal roiling Latin America has stalled investments and ensnared him in allegations of wrongdoing. Before the vote on Thursday, Kuczynski fanned fears of a return to Peru’s authoritarian past and described the motion as part of a legislative “coup” attempt by Keiko’s supporters. Popular Force denies the charge and says the bid to remove him was part of its fight against corruption and within the bounds of the constitution. A hardline Popular Force lawmaker loyal to Keiko, Hector Becerril, said the Kenji faction represented “traitors.”  “If they have any sense of decency after this vote, the least they could do is present their resignations,” Becerril told journalists on Friday. “Hopefully today.” With 10 votes fewer, Popular Force would command 61 seats in the 130-member, single-chamber Congress, less than an absolute majority, though it would still be the biggest voting bloc. The political crisis has cost Kuczynski his interior minister, Carlos Basombrio, who announced his resignation on Friday. Kuczynski could make a decision about other Cabinet changes in coming days, his government said.             ",politicsNews,"December 23, 2017 "
"Trump signs tax, government spending bills into law","WASHINGTON (Reuters) - U.S. President Donald Trump signed Republicans’ massive $1.5 trillion tax overhaul into law on Friday, cementing the biggest legislative victory of his first year in office, and also approved a short-term spending bill that averts a possible government shutdown. Trump said he wanted to sign the tax bill before leaving Washington on Friday for his Mar-a-Lago estate in Florida, rather than stage a more formal ceremony in January, so he could keep his promise to finish work before Christmas. “I didn’t want you folks to say I wasn’t keeping my promise. I’m keeping my promise,” he told reporters in the White House. The two pieces of legislation represent Trump’s most significant accomplishment with Congress since taking office in January, as well as a sign of what awaits when he returns from Florida after the Christmas holiday. The tax package, the largest such overhaul since the 1980s, slashes the corporate rate from 35 percent to 21 percent and temporarily reduces the tax burden for most individuals as well. Trump praised several companies that have announced employee bonuses in the wake of the bill’s passage, naming AT&T, Boeing, Wells Fargo, Comcast  and Sinclair Broadcast Group. “Corporations are literally going wild over this,” he said.      Democrats had opposed the bill as a giveaway to the wealthy that would add $1.5 trillion to the $20 trillion national debt during the next decade. The spending bill extends federal funding through Jan. 19, largely at current levels. It does nothing to resolve broader disputes over immigration, healthcare and military spending. Republicans also are divided over whether to follow up their sweeping overhaul of the U.S. tax code with a dramatic restructuring of federal benefit programs. House Speaker Paul Ryan has said he would like to revamp welfare and health programs but Senate Republican Leader Mitch McConnell told National Public Radio on Monday that he was not interested in cutting those programs without Democratic support. Trump’s year also closes with significant turnover of many top staffers who had been in the White House since early in his term. On Friday, the White House confirmed Deputy Chief of Staff Rick Dearborn and Jeremy Katz, who worked under White House economic adviser Gary Cohn, were leaving. ",politicsNews,"December 22, 2017 "
