title,text,subject,date
U.S. responds in court fight over illegal Indonesian immigrants,"BOSTON (Reuters) - U.S. immigration officials sought to block a federal judge’s order delaying efforts to deport 51 Indonesians living illegally in New Hampshire, saying they have not shown they would face harm if repatriated, court documents on Wednesday showed. The U.S. government’s motion in federal court in Boston was in response to a judge’s order last month that found members of the group should be given time to make a case that changed conditions in the southeast Asian nation would make it dangerous for them to return. “Even if they are removed, petitioners’ generalized evidence of Indonesia’s conditions do not prove that persecution or torture is immediate or likely for each petitioner,” the motion said. It said the court lacked jurisdiction over their claims, and the immigrants did not state any plausible claims.  The group of ethnic Chinese Christians fled the world’s largest Muslim-majority country following violence that erupted 20 years ago and have been living openly for years in New England under an informal deal reached with U.S. Immigration and Customs Enforcement (ICE). Beginning in August, members of the group who showed up for ICE check-ins were told to prepare to leave the country, in keeping with U.S. President Donald Trump’s campaign promise to crack down on illegal immigration. Members of the group have said in interviews with Reuters that they entered the country on tourist visas but overstayed them and failed to seek asylum on time. Several said they fear they would face persecution or violence for their Christian faith and Chinese ethnicity if they were returned to Indonesia. Federal law gives authority over immigration matters to the executive branch, not the courts, and ICE contends that it has always had authority to deport members of the group. Chief U.S. District Judge Patti Saris in Boston last month found she had authority to ensure the Indonesians have a chance to argue that conditions in their home country had deteriorated significantly enough to reopen their cases for trying to stay in the United States. The Indonesians are part of an ethnic community of about 2,000 people clustered around the city of Dover, New Hampshire. Their cause has drawn the support of the state’s all-Democratic congressional delegation, including U.S. Senator Jeanne Shaheen, and Republican Governor Chris Sununu. ",politicsNews,"December 21, 2017 "
Democrat Franken to leave Senate on January 2,"WASHINGTON (Reuters) - U.S. Democratic Senator Al Franken, who earlier this month announced his plan to resign following sexual misconduct allegations against him, will step down on Jan. 2, a representative for the lawmaker said on Wednesday. The 66-year-old former comedian from Minnesota had been seen as a rising star in the Democratic Party, but faced growing calls from fellow Senate Democrats to step down as allegations against him mounted. Franken is one of several influential men who have lost their jobs after being accused of sexual misconduct, assault or harassment, including Hollywood executive Harvey Weinstein and journalists Matt Lauer, Charlie Rose and Tavis Smiley. He will be the third lawmaker facing misconduct allegations to depart from Congress following Democratic Representative John Conyers and Republican Representative Trent Franks. Two others, Democratic Representative Ruben Kihuen and Republican Representative Blake Farenthold, have said they will not seek re-election next year. Franken has denied some of the allegations against him and questioned others. Reuters has not independently verified any of the allegations. Minnesota’s Democratic governor, Mark Dayton, last week appointed Lieutenant Governor Tina Smith, who is also a Democrat to fill Franken’s seat. Smith, 59, will serve a one-year term concluding in January 2019, Dayton said, and will run in a special election for the seat next November. ",politicsNews,"December 20, 2017 "
U.S. lawmakers seek temporarily extension to internet spying program,"WASHINGTON (Reuters) - Republican leaders in the U.S. House of Representatives are working to build support to temporarily extend the National Security Agency’s expiring internet surveillance program by tucking it into a stop-gap funding measure, lawmakers said. The month-long extension of the surveillance law, known as Section 702 of the Foreign Intelligence Surveillance Act, would punt a contentious national security issue into the new year in an attempt to buy lawmakers more time to hash out differences over various proposed privacy reforms.  Lawmakers leaving a Republican conference meeting on Wednesday evening said it was not clear whether the stop-gap bill had enough support to avert a partial government shutdown on Saturday, or whether the possible addition of the Section 702 extension would impact its chances for passage. Absent congressional action the law, which allows the NSA to collect vast amounts of digital communications from foreign suspects living outside the United States, will expire on Dec. 31. ",politicsNews,"December 21, 2017 "
Top Democrat says Trump firing of Mueller could provoke 'constitutional crisis',"WASHINGTON (Reuters) - The top Democrat on the U.S. Senate Intelligence Committee, responding to escalating Republican attacks on Special Counsel Robert Mueller, said on Wednesday that if President Donald Trump fires Mueller, it “has the potential to provoke a constitutional crisis.” Speaking on the Senate floor, Senator Mark Warner denounced attacks on Mueller’s impartiality and said the special counsel’s investigation of ties between Trump’s presidential campaign and Russia must be “able to go on unimpeded.” Russia denies meddling in the 2016 U.S. election and Trump has denied any collusion. While Trump’s political allies have increased their criticism of Mueller, the president said on Sunday he was not considering firing him. Republican lawmakers have seized on anti-Trump texts by a Federal Bureau of Investigation agent who was involved in the Russia investigation as evidence of bias in Mueller’s team. Mueller removed the agent from his team after the texts came to light. Republicans on several House of Representatives committees have also announced their own probes into long-standing political grievances, including the FBI’s handling of Hillary Clinton’s use of a private email server when she was secretary of state. Clinton, a Democrat, was Trump’s opponent in last year’s election. “Over the last several weeks, a growing chorus of irresponsible voices have called for President Trump to shut down Special Counsel Mueller’s investigation,” said Warner, adding that the attacks were “seemingly coordinated.” “Firing Mr. Mueller or any other of the top brass involved in this investigation would not only call into question this administration’s commitment to the truth, but also to our most basic concept of rule of law,” Warner said. “It also has the potential to provoke a constitutional crisis.” Warner called for Congress to make clear to the president that firing Mueller would have “immediate and significant consequences.” House Democrats had circulated rumors last week that Trump would fire Mueller this Friday, just before the Christmas holiday. Trump’s White House lawyer, Ty Cobb, said in a statement on Wednesday that the administration “willingly affirms yet again, as it has every day this week, there is no consideration being given to the termination of the special counsel.” “If the media is going to continue to ask for responses to every absurd and baseless rumor, attention-seeking partisans will continue to spread them,” Cobb added. ",politicsNews,"December 20, 2017 "
U.S. tax bill may face lawsuits with long odds but political payoffs,"(Reuters) - Democratic-leaning states may take legal action to challenge the cap on deductions of state and local taxes under the sweeping overhaul of the U.S. tax code, and even though such lawsuits would face long odds they could help galvanize Democrats for next year’s mid-term election. The U.S. tax bill, passed by Republicans in Congress on Wednesday, limits deductions of state and local income and property taxes, known as SALT, to $10,000. The provision hits hardest Democratic-leaning states with high incomes, high property values and high taxes, like New York, New Jersey and California.  Law professors said legal challenges would likely rest on arguing that the provision interferes with the protection of states’ rights under the U.S. Constitution. Some political strategists see a win for Democrats regardless of how courts ultimately rule, saying that lawsuits could be used to keep the issue front and center for voters already largely disenchanted with the Republican party. “It’s a no-brainer for them to do this,” said Democratic political consultant Phil Singer. “Failing to aggressively pursue a remedy would be political malpractice.” New Jersey Governor-elect Phil Murphy said during an appearance on CNBC on Wednesday that “everything is on the table” for New Jersey to oppose the bill, including challenging its “legality and constitutionality.”  The governors of California and New York, Jerry Brown and Andrew Cuomo, have both previously said they were exploring legal challenges to SALT deduction limits. Their offices did not return requests for comment on Wednesday. Since President Donald Trump took office, blue states have aggressively used the courts to attempt to block the president’s agenda, suing over his proposed travel ban, environmental policies and other measures. William O’Reilly, a conservative political consultant in New York, said the SALT deduction issue would likely add to Republicans’ “suburbia problem” among college-educated voters ahead of the 2018 midterm elections. “They already had one because of this president’s style,” O’Reilly said. Darien Shanske, a tax law professor at the University of California Davis School of Law, said the governors would probably argue that restricting the SALT deduction, which dates back to the introduction of the federal income tax in 1862, violates the U.S. Constitution’s 10th Amendment that protects states’ rights. Shanske and other tax experts said the federalism argument would need to overcome the U.S. Supreme Court’s historically broad interpretations of Congress’ 16th Amendment power to impose taxes. “As a general matter, nothing prevents the federal government from changing the SALT deduction,” said David Gamage, a professor of tax law at Indiana University’s Maurer School of Law. In a frequently cited 1934 decision, the Supreme Court called tax deductions a “legislative grace” rather than a right, and said Congress has broad leeway to abolish them. The court reiterated this view in a 1988 decision allowing Congress to remove a federal tax exemption for interest on some state and local bonds.  Kirk Stark, a professor of tax law at the University of California, Los Angeles School of Law, said there is a slight possibility that a federalism argument against limiting the SALT deduction could gain traction. “Courts create new law all the time,” he said, noting that decisions on matters this sweeping tend to become political. But some legal experts noted that the state’s rights argument is more typically a conservative position. Using it to challenge the SALT provision could be a move that Democratic governors come to regret in the future, said Daniel Hemel, a professor at the University of Chicago Law School.   “The progressive agenda depends on the federal government being able to raise revenue and the Supreme Court not getting in the way of that,” Hemel said. ",politicsNews,"December 21, 2017 "
Vote in Senate on 'Dreamers' hinges on bipartisan pact: McConnell,"WASHINGTON (Reuters) - U.S. Senate Majority Leader Mitch McConnell on Wednesday said he would bring a “Dreamers” immigration bill to the Senate floor if bipartisan negotiations between senators and the Trump administration produce an agreement by the end of January. McConnell also said in a statement that he would offer the measure as a “free-standing vote,” without specifying when it would occur. Many supporters of the immigration initiative have argued that it would have the best prospects for passage if it was coupled with a must-pass bill such as a spending measure early next year that potentially increases military spending. The immigration measure would be designed to protect undocumented immigrants who were brought to the United States as children. Democrats in Congress have been pressing for passage well before early March, when an Obama-era program is due to be completely phased out by the Trump administration. Earlier on Wednesday, Republican U.S. Senator Jeff Flake said in a statement that McConnell had promised to bring such a bill to the full Senate next month. Flake is one of a group of seven Democratic and Republican senators negotiating a bill. Former President Barack Obama’s Deferred Action for Childhood Arrivals order temporarily protected around 800,000 Dreamers from deportation. President Donald Trump announced in September he was terminating the program but had asked Congress to devise a more permanent solution by March. A San Francisco federal judge on Wednesday wrestled with whether to order the government to keep DACA in place, while lawsuits challenging Trump’s decision unfold. At a hearing, U.S. District Judge William Alsup questioned whether he had the authority to review the decision to end DACA, but also said the administration’s justification for its move was brief and “conclusory.” Alsup did not rule from the bench.  One of the plaintiffs, DACA recipient Dulce Garcia, attended the hearing and said she was in the sixth day of a hunger strike intended to urge lawmakers to make protection of DACA recipients a condition for passage of any more federal spending bills. Democratic Senator Dick Durbin said in a statement, “Bipartisan negotiations continue and we’re fighting to pass this measure soon.” He did not provide details on any progress being made in the talks.  A bipartisan group of senators led by Durbin and Republican Lindsey Graham have been holding private negotiations over how many Dreamers would be covered by legislation giving them temporary legal status and whether they would ultimately be allowed to apply for U.S. citizenship. The negotiations have been complicated by Republican demands that increased border security be included in any legislation. Republicans also have been clamoring for more immigration enforcement throughout the United States. Democrats have been opposed to that as part of a Dreamer measure, saying it is a way for the Trump administration to step up its deportations of undocumented relatives of Dreamers, thus breaking up families currently in the United States. ",politicsNews,"December 20, 2017 "
White House says tax bill will not hurt Puerto Rico,"WASHINGTON (Reuters) - Sweeping tax code changes aimed at keeping U.S. companies from shifting profits offshore to avoid taxes will not affect the battered economy of Puerto Rico, a senior White House official said on Wednesday. Puerto Rico Governor Ricardo Rossello has said the provisions in a new tax bill passed by Congress could prompt drug and medical device manufacturers to leave the island territory, which is considered a foreign jurisdiction for tax purposes. “I personally do not think that this is going to hurt Puerto Rico,” the White House official told reporters, speaking on condition of anonymity. The tax base erosion provisions in the bill provide exemptions for the cost of goods U.S. companies buy offshore, meaning supplies made in Puerto Rico would not be affected, the White House official said. The manufacturing plants are an economic lifeline for 3.4 million Americans in the territory, where the economy never recovered after Congress in 2006 ended a different set of longstanding business tax breaks. Puerto Rico has $120 billion of combined bond and pension debt and near-insolvent public health systems, and filed the largest-ever U.S. government bankruptcy this year. Three months ago, Hurricane Maria slammed into the island, tearing up homes and the power grid and bringing its economy to a halt. Congress is considering an $81 billion disaster aid bill - some of which is aimed at Puerto Rico - as part of a must-pass government funding bill. ",politicsNews,"December 20, 2017 "
Democrats plan to use tax bill to attack Republicans at midterms,"WASHINGTON (Reuters) - The tax bill is President Donald Trump’s biggest legislative victory this year, but Democratic strategists are already planning how to turn it into his biggest liability. The emotional trigger they think will work on voters at next year’s midterm elections: arguing the bill is profoundly unfair by giving the lion’s share of benefits to corporations and the rich.   “Be careful what you wish for,” Tom Steyer, a Democratic billionaire, said of Republican leaders in an interview with Reuters on Wednesday. “They wanted this, they should have never have wanted it. Now that they’ve got it, they’re going to wish they didn’t.” Steyer said he plans to use his money - through his political group NextGen America - to attack the Republican tax overhaul, using social media and online advertising aimed at young voters, a strategy that recently helped elect Democratic candidate Doug Jones in a Senate race in Alabama and Ralph Northam as governor of Virginia. In November 2018, elections will be held for all 435 seats in the U.S. House of Representatives and for 34 seats in the 100-member Senate.  Pollsters believe the midterms could be a rare “wave election,” when one party seizes back control of Congress. It happened for Republicans in 2010 and 1994.  If Democrats are able to pick up two more Senate seats, they will take control of the chamber. And after the wins in Alabama and Virginia, they are even hopeful they could tap into anger over tax cuts for the rich to win control of the House. Only about 29 percent of voters approve of the tax bill, according to a Reuters/Ipsos poll conducted in mid December. Slightly more than 52 percent oppose it. In no region of the country did even half of the people polled say they support it.  The Democratic Senate Campaign Committee is already running anti-tax plan ads in several key states including Nevada, Arizona, Indiana, Ohio, Pennsylvania and Wisconsin.  The ads are only five-second spots running before YouTube videos. The viewer, unable to skip over the ads, will hear: “The Republican tax scheme gives huge breaks to corporations but raises taxes on middle class families.” The tax bill cuts the corporate tax rate to 21 percent and raises the threshold at which an inheritance is taxed. It also cuts the tax rate for top earners.  While it also cuts the tax rate for most other income groups and doubles the size of the standard deduction, the elimination of other popular deductions could result in some taxpayers seeing a tax increase instead of a cut. It has been popular with the Republican base, Trump voters and the party’s donors. The stock market has surged in anticipation of the cuts.     Democrats plan to focus on provisions like benefits to commercial real estate owners, arguing that the tax bill could produce millions of dollars of more cash for Trump and his family members. The White House asserts Trump will not personally benefit – but it admits that his business might.   The Super PAC American Bridge, which supports Democratic candidates, is running digital ads in states with Senate races targeting women, swing voters and Republicans in suburban areas, said Joshua Karp, the group’s communication director for Senate races.   “I think there is a couple of things that get almost all Americans riled up about this bill, it is fundamentally unfair and breaking the promise the Republicans made to the American people,” Karp said.  Republicans say Democrats are indulging in wishful thinking. Polls say 50 percent of voters think their taxes will go up, but tax analysts say that 80 percent will pay less tax.  Republicans are counting on voters, when they see more money in their paychecks, to dismiss Democratic rhetoric, and perhaps even throw their support behind Trump.  And if there are any unpleasant surprises in store for taxpayers, they will not be filing their first tax returns under the new law until early 2019, months after the midterm elections.  Republican strategist Alex Conant, a veteran of congressional and presidential campaigns, said the unpopularity of the tax cuts in opinion polls can be directly attributed to Trump’s low approval levels.  “We’re losing elections because Donald Trump is incredibly unpopular and makes a lot of independents and soft Republicans uncomfortable ... Trump’s numbers are dragging down tax reform’s numbers,” Conant said, although he also played down the electoral risks of the tax overhaul. “I would be very surprised if people are marching in the streets months from now because we cut their taxes.”  Republicans have some other advantages, like the growing economy, that means an attack on the tax overhaul could backfire.  “Democrats will have a very hard time taking this road if the economy is still going gang busters 11 months from now,” Republican strategist Joe Bretell said. But he acknowledges that the Democrats are on the right track.  “The emotional trigger point is in fairness,” he said. “The party that can best explain or brand this bill and explain why it’s fair or unfair to their base or the other side, wins.” ",politicsNews,"December 20, 2017 "
"After ruling, Virginia legislature's majority to be chosen by lot","(Reuters) - Republicans could hold onto control of Virginia’s legislature after a race that had appeared to change the balance of power was ruled a tie on Wednesday, setting the stage for the winner of the district to be chosen by lot. The results of a recount on Tuesday showed Democrat Shelly Simonds beating Republican incumbent David Yancey by one vote, enough to shift the 100-member House of Delegates to an even 50-50 split between Democrats and Republicans. However, on Wednesday a three-judge panel ruled that a disputed ballot should be counted for Yancey, the Virginian-Pilot newspaper reported and Yancey confirmed. The two candidates in the 94th District, which includes Newport News in southeastern Virginia, are now tied at 11,608 votes. Under Virginia law, a tie in a House race should be decided by drawing lots, the equivalent of a coin toss or drawing straws, the Conference of State Legislatures said. “I am happy that every vote in Newport News was counted and that the judges took time to deliberate before rendering a decision,” Yancey said in an emailed statement. “This certainly is a historic election in our Commonwealth.” But Democrats slammed the decision, calling it erroneous and saying they were considering legal action to challenge it. Just Tuesday, Republicans conceded the seat, and Simonds, who made international news with what had appeared to be a narrow win, spent the morning Wednesday discussing the race on a variety of news shows. She did not immediately respond to a request for comment following Wednesday’s decision, but an attorney for the Virginia House Democratic Caucus criticized the judges’ move in a news release. “Today’s decision by the court was wrong, and Delegate-elect Shelly Simonds should have been certified the winner,” he said. “We are currently assessing all legal options before us as we fight for a just result.”  Democrats claimed historic gains in Virginia’s statehouse last month, part of the party’s first big wave of victories since Republican Donald Trump won the White House last year. Before the Nov. 7 general election, Virginia Republicans held 66 seats to the Democrats’ 34 in the House of Delegates, along with a majority in the state Senate.  ",politicsNews,"December 20, 2017 "
