title,text,subject,date
"Congress votes to avert shutdown, sends Trump stopgap spending bill","WASHINGTON (Reuters) - The U.S. Congress on Thursday averted a government shutdown just one day before federal funding was due to expire, sending President Donald Trump a bill to provide just enough money to keep agencies operating through Jan. 19. With lawmakers eager to begin a holiday recess until Jan. 3, the House of Representatives and Senate scurried to pass the hastily written bill by votes of 231-188 and 66-32, respectively. When Congress returns, lawmakers will immediately have to get back to work on appropriating more money for a fiscal year that already will be three months old. They will try to pass an “omnibus” spending bill to fund the government from Jan. 19 through Sept. 30. Negotiators have been struggling for months over thorny issues such as the amount of defense-spending increases versus increases for other domestic programs, including medical research, opioid treatment and “anti-terrorism” activities. Fiscal hawks, meanwhile, are angry that Congress is again moving to bust through spending caps that had been designed to tamp down mounting federal debt. But some of those same lawmakers in the Republican-controlled Congress earlier in the week voted for a sweeping tax bill that will add $1.5 trillion over the next 10 years to a national debt that already stands at $20 trillion. With the clock ticking toward a deadline of midnight on Friday when government funding would run out, Democrats in the House and Senate made a strong pitch for including protections for young immigrants who entered the country illegally as children, popularly known as “Dreamers.” In the end, the Congressional Hispanic Caucus and immigration advocacy groups failed. But nearly all of the House’s 193 Democrats and 29 of the Senate’s 46 Democrats voted no, in part to protest the lack of action on the immigration measure. Shortly before the House and Senate votes, Democratic Representative Luis Gutierrez told reporters, “We’re really tired of tomorrow,” referring to years of failed attempts in Congress to protect Dreamers from deportation, allow them to legally work in the United States and get on a path to citizenship. They will resume their fight in January, aiming to win on the next spending bill or a separate measure. Trump has eliminated Obama-era temporary protections for Dreamers, but has asked Congress to come up with a permanent solution by March. In the meantime, about 122 Dreamers a day are becoming vulnerable to deportation while Congress bickers. Also on Thursday, the Senate put the brakes on another bill that passed the House, which would provide $81 billion in new disaster aid to help Puerto Rico, the U.S. Virgin Islands and several states hit by this year’s hurricanes or wildfires. The temporary spending bill did, however, give Trump a modest increase of $4.7 billion for the Department of Defense to be used for missile defense and ship repair. The bill includes $2.85 billion to fund the Children’s Health Insurance Program through March and funding for community health centers and the Indian Health Service. The plan also would extend the National Security Agency’s expiring internet surveillance program, known as Section 702 of the Foreign Intelligence Surveillance Act, through Jan. 19. Other provisions address funding for veterans, the Coast Guard and flood insurance. Most government programs would be temporarily extended until Jan. 19 at fiscal 2017 levels. ",politicsNews,"December 21, 2017 "
Factbox: Big-ticket items at center of Congress spending bill,"(Reuters) - The U.S. Congress on Thursday approved a temporary funding bill to prevent federal agencies from shutting down at midnight Friday when existing money was set to expire. The following are the major items that were debated on the legislation that President Donald Trump is expected to sign into law: The Friday midnight deadline for action was the result of the Republican-controlled Congress failing to pass any of the regular appropriations bills for the fiscal year that began Oct. 1. Instead, the government has been operating on a series of temporary measures. This newest stopgap bill continues funding for government operations through Jan. 19, giving lawmakers several weeks to work out a spending bill that would pay for agency activities through Sept. 30, the end of the current fiscal year.  House of Representatives conservatives failed in their bid to attach a major defense spending increase that would fund the Pentagon through September. Instead, Congress agreed to fund the military through Jan. 19, like most other programs. But in a move to attract support, a $4.7 billion increase was included to be used for missile defense and ship repair. Democrats and Republicans will continue negotiations on higher funding for both military and non-military programs. An $81 billion disaster aid bill was going to be attached to the government funding bill. Instead, the House approved it as a stand-alone bill, only to see the Senate put off action until at least next month. It would build on about $52 billion already provided to Puerto Rico, the U.S. Virgin Islands and several states hit by severe hurricanes, wildfires or other natural disasters. Democrats want to do more for Puerto Rico and some Republicans worry about the mounting costs of disaster aid. The Children’s Health Insurance Program, which helps provide medical care to nearly 9 million children in low-income families, will get $2.85 billion to cover expenses through March as lawmakers seek a more permanent solution. Senators put off until early next year their bid to maintain healthcare subsidies for low-income people participating in the Affordable Care Act, also known as Obamacare. Many House Republican lawmakers dislike the idea. The National Security Agency’s warrantless internet surveillance program under the Foreign Intelligence Surveillance Act will be extended through Jan. 19 as lawmakers try to reconcile competing versions of such legislation in the House and Senate.  Legislation to protect “Dreamers” from deportation was not included, despite Democrats’ push to resolve the issue by year’s end. It was a major disappointment for the Congressional Hispanic Caucus and immigration advocacy groups. But negotiators are still trying to reach a deal on helping immigrants, many from Mexico and Central America, brought to the United States illegally as children. The issue is expected to come back to life in early 2018.   ",politicsNews,"December 21, 2017 "
"In victory for Trump, judge tosses suit on foreign payments","NEW YORK (Reuters) - A federal judge in New York on Thursday threw out a lawsuit that had accused President Donald Trump of violating the U.S. Constitution by accepting foreign payments through his hotels and other businesses, handing him a major victory on an issue that has dogged him since even before he took office in January. Though other lawsuits remain pending that make similar claims, the ruling by U.S. District Judge George Daniels is the first to weigh the merits of the U.S. Constitution’s anti-corruption provisions as they apply to Trump, a wealthy businessman who as president regularly visits his own hotels, resorts and golf clubs. In a 29-page opinion granting the Trump administration’s request to toss the suit, Daniels said the plaintiffs did not have legal standing to bring the suit. The plaintiffs included the nonprofit watchdog group Citizens for Responsibility and Ethics in Washington (CREW), a hotel owner, a hotel events booker and a restaurant trade group. The lawsuit, filed after the Republican president took office in January, accused Trump of running afoul of the Constitution’s “emoluments” clause by maintaining ownership of his business empire while in office.  The emoluments clause, designed to prevent corruption and foreign influence, bars U.S. officials from accepting gifts from foreign governments without congressional approval. Trump has ceded day-to-day control of his businesses to his sons. Critics have said that is not a sufficient safeguard. The plaintiffs said they are legally injured when foreign governments try to “curry favor” with Trump by paying to use his businesses, such as the Trump International Hotel in Washington or a high-end restaurant at a Trump hotel in New York City. The plaintiffs said this leads them to have lost patronage, wages and commissions. U.S. Department of Justice spokeswoman Lauren Ehrsam said the Trump administration “appreciates the court’s ruling.” Daniels, appointed to the bench by Democratic former President Bill Clinton, said in his decision that the plaintiffs’ claims were speculative. Daniels said Trump had amassed wealth and fame even before taking office and was competing in the hospitality industry.  “It is only natural that interest in his properties has generally increased since he became president,” the judge wrote. The judge also said that if Congress wanted to do something about the president’s actions, it could. “Congress is not a potted plant,” Daniels said. “It is a co-equal branch of the federal government with the power to act.” CREW Executive Director Noah Bookbinder said that his legal team is weighing options on how to proceed. “While today’s ruling is a setback, we will not walk away from this serious and ongoing constitutional violation,” Bookbinder added. Some legal experts had raised concerns even before his inauguration on Jan. 20 that Trump would violate the emoluments clause as president.  ",politicsNews,"December 21, 2017 "
Senate shelves disaster aid bill until next month,"WASHINGTON (Reuters) - Legislation to provide $81 billion in new disaster aid for U.S. states, Puerto Rico and the U.S. Virgin Islands was put on hold by the Senate on Thursday amid attacks from both Republicans and Democrats. The Republican-controlled House of Representatives passed the legislation earlier on Thursday to help recovery efforts stemming from hurricanes and wildfires. But the Senate put off a vote until at least January, according to some lawmakers and aides, after Democrats complained Puerto Rico was not getting enough help and some fiscal hawks fretted about the overall cost. ",politicsNews,"December 22, 2017 "
"Trump on Twitter (Dec 21) - Tax Cuts, Home sales","The following statements were posted to the verified Twitter accounts of U.S. President Donald Trump, @realDonaldTrump and @POTUS.  The opinions expressed are his own. Reuters has not edited the statements or confirmed their accuracy.  @realDonaldTrump : - The Massive Tax Cuts, which the Fake News Media is desperate to write badly about so as to please their Democrat bosses, will soon be kicking in and will speak for themselves. Companies are already making big payments to workers. Dems want to raise taxes, hate these big Cuts! [0724 EST] - Was @foxandfriends just named the most influential show in news? You deserve it - three great people! The many Fake News Hate Shows should study your formula for success! [0745 EST] - Home Sales hit BEST numbers in 10 years! MAKE AMERICA GREAT AGAIN [0856 EST] - House Democrats want a SHUTDOWN for the holidays in order to distract from the very popular, just passed, Tax Cuts. House Republicans, don’t let this happen. Pass the C.R. TODAY and keep our Government OPEN! [0952 EST] -- Source link: (bit.ly/2jBh4LU) (bit.ly/2jpEXYR) ",politicsNews,"December 21, 2017 "
House widens ethics probe to include Farenthold campaign work,"WASHINGTON (Reuters) - The ethics probe into U.S. Representative Blake Farenthold, who is already under a cloud for alleged sexual misconduct, is being expanded to look into whether he mixed his political campaign with congressional work and lied to the House Ethics Committee, the panel said on Thursday. Last week, Farenthold said he would not seek re-election next year after accounts surfaced that he created a hostile work environment. The Texas Republican denied allegations of sexual harassment but admitted allowing an unprofessional culture in his Capitol Hill office. On Thursday the ethics committee voted unanimously to investigate whether Farenthold used his congressional staff and other resources of the House of Representatives to further his political campaign, and if he had made false statements or omissions to the committee. The panel was already looking into whether he committed sexual harassment, discrimination and retaliation against a former staff member and if he made inappropriate statements to other members of his staff.  The committee said the announcement should not be read as an indication that it had found any rule violations. Farenthold’s office did not immediately respond to a request for comment. Congress strictly divides lawmakers’ work on Capitol Hill and their runs for re-election so that taxpayers do not end up subsidizing political campaigns. In August, the committee went so far as to warn Representatives, who face elections every two years, they should not even send texts or forward emails related to their campaigns while in House buildings. Congress is reviewing its workplace policies on sexual harassment after a number of lawmakers have been accused of sexual misconduct in recent weeks amid a wave of such allegations against powerful men in entertainment, politics and the media. A bipartisan group of lawmakers in the House said on Thursday intends to introduce legislation in January reforming a 20-year-old law that covers sexual harassment in Congress, which it hopes will pass soon after. ",politicsNews,"December 21, 2017 "
U.S. court rejects Trump bid to stop transgender military recruits on Jan. 1,"NEW YORK (Reuters) - A federal appeals court in Virginia on Thursday rejected a bid by President Donald Trump’s administration to prevent the U.S. military from accepting transgender recruits starting Jan. 1. The administration had urged the appeals court to suspend an order by a federal judge in Baltimore for the armed forces to begin accepting transgender recruits on that date. The administration has said the Jan. 1 start date was causing the armed forces to scramble to revise their policies at the risk of harming military readiness.  In a brief two-paragraph order, the three-judge panel of the Richmond-based 4th U.S. Circuit Court of Appeals said it was denying the administration’s request while the appeal proceeds. All three judges are Democratic appointees.  The court’s action could prompt the administration to ask the conservative-majority U.S. Supreme Court to intervene. “We disagree with the court’s ruling and are currently evaluating the next steps,” U.S. Justice Department spokeswoman Lauren Ehrsam said in a statement. Several transgender service members, backed by the American Civil Liberties Union, filed suit in Maryland after Trump said in July he would ban transgender people from the military, a move that would reverse a policy of the Republican president’s Democratic predecessor Barack Obama to accept them. Trump cited concern over military focus and medical costs. So far, three federal judges around the country have issued injunctions blocking Trump’s ban. His administration has appealed all three rulings.  Joshua Block, an ACLU attorney who represents the plaintiffs in the Maryland case, said he was happy the appeals court saw through the government’s “smokescreen” to further delay enlistment.  Thursday’s action was in response to the administration’s appeal of a Nov. 21 ruling by U.S. District Judge Marvin Garbis, who said that the transgender prohibition likely violates the plaintiffs’ constitutional right to equal protection under the law. The Garbis ruling followed a similar one on Oct. 30 by another federal judge in Washington, D.C. A third judge in Seattle also ruled against the administration on Dec. 11. In an August memorandum, Trump gave the military until March 2018 to revert to a policy prohibiting openly transgender people from joining the military and authorizing their discharge. The memo also halted the use of government funds for sex-reassignment surgery for active-duty military personnel. The Obama administration had set a deadline of July 1 of this year to begin accepting transgender recruits. But Trump’s defense secretary, James Mattis, postponed that date to Jan. 1, which the president’s ban then put off indefinitely. The Trump administration said in legal papers that the armed forces are not prepared to train thousands of personnel on the medical standards needed to process transgender applicants and might have to accept “some individuals who are not medically fit for service.” The Pentagon on Dec. 8 issued guidelines to recruitment personnel in order to enlist transgender applicants by Jan. 1. The memo outlined medical requirements and specified how the applicants’ sex would be identified and even which undergarments they would wear. The ban’s challengers said the memo contradicted the claim that the military was not ready.  The Justice Department disagreed, telling the court on Wednesday that “all this memorandum shows is that the military is scrambling to comply with the injunction.” The lawsuit’s lead plaintiff Brock Stone, 34, has served in the U.S. Navy for 11 years, including a nine-month deployment to Afghanistan, and wants to remain for at least 20 years, according to court papers.  ",politicsNews,"December 21, 2017 "
U.S. House approves $81 billion for disaster aid,"WASHINGTON (Reuters) - The U.S. House of Representatives on Thursday approved an $81 billion bill to help widespread recovery efforts from hurricanes and wildfires this year. By a vote of 251-169, the House passed the measure to help Puerto Rico, the U.S. Virgin Islands and states rebuild following the natural disasters. The bill now goes to the Senate where it is expected to be approved this week. ",politicsNews,"December 21, 2017 "
House Democrats rally to protect Special Counsel Mueller,"WASHINGTON (Reuters) - Democrats in the U.S. House of Representatives rallied behind Special Counsel Robert Mueller on Thursday, after recent attempts by Republicans and conservative news outlets to discredit him and his probe into Russian interference in the 2016 presidential election. In a letter sent to Justice Department Deputy Attorney General Rod Rosenstein, 171 of the 193 Democrats in the House said they support Mueller’s probe, and urged Rosenstein to let it continue “unfettered by political influence or threats to his authority.”  “We will not stand by and allow Fox News and right-wing Republicans to defy the rule of law and create their own rules to interfere with the legitimate investigation under the Constitution of the United States,” California Democrat Maxine Waters said during a press conference Thursday. “There is an organized effort by Republicans ... to spin a false narrative and conjure up outrageous scenarios to accuse Special Counsel Mueller of being biased,” she added. Rosenstein appointed Mueller as Special Counsel in May, after President Donald Trump fired former FBI Director James Comey for what Trump later said was “this Russia thing.” Critics promptly accused the president of trying to obstruct the probe. Mueller is investigating whether Trump’s presidential campaign colluded with Russia to interfere with the election. Russia has denied meddling and Trump has said there was no collusion.  Republican criticism of Mueller, himself a member of their party, has intensified in recent months since he charged four of Trump’s close associates, including former campaign manager Paul Manafort and former National Security Adviser Michael Flynn. Republicans and talk show hosts on Fox News have accused Mueller’s team and the Federal Bureau of Investigation of bias, citing issues including anti-Trump text messages exchanged between two FBI staffers who previously worked on Mueller’s team. House Republicans have launched their own investigation into the FBI’s handling of Hillary Clinton’s emails, and questioned whether she received favorable treatment after no charges were brought. Recently, rumors have flown around Washington that Trump may be seeking to have Mueller fired. Trump’s lawyers have said that is not true. Rosenstein, also a Republican, oversees Mueller’s team. He can only fire Mueller for good cause, and he told Congress last week he sees no legitimate basis for doing so. “This investigation must continue unimpeded,” House Judiciary Committee Ranking Democrat Jerrold Nadler said Thursday. Nadler said Republicans were trying to “provide cover for the President as the walls close in on him.” ",politicsNews,"December 21, 2017 "
Second U.S. judge blocks Trump administration birth control rules,"SAN FRANCISCO (Reuters) - A second U.S. judge on Thursday blocked President Donald Trump’s administration from enforcing new rules that undermine an Obamacare requirement for employers to provide insurance that covers women’s birth control. U.S. District Judge Haywood Gilliam Jr. in Oakland, California, said the federal government likely did not follow proper administrative procedures in promulgating the new rules, and put them on hold while a lawsuit challenging their legality proceeds. The decision followed a similar ruling from a federal judge in Philadelphia last Friday that blocked the administration from enforcing rules it announced in October allowing businesses or nonprofits to obtain exemptions on moral or religious grounds. Gilliam ruled on a lawsuit pursued by Democratic attorneys general in California, Delaware, Maryland, New York and Virginia. He said that a preliminary injunction was necessary given the “dire public health and fiscal consequences” that could result as a result of the administration adopting the rules without the input of interested parties. “If the Court ultimately finds in favor of Plaintiffs on the merits, any harm caused in the interim by rescinded contraceptive coverage would not be susceptible to remedy,” he wrote. California Attorney General Xavier Becerra said in a statement that, given last week’s decision in Pennsylvania, “today’s ruling amounts to a one-two punch against the Trump administration’s unlawful overreach.” The U.S. Justice Department defended the rules in court.  Lauren Ehrsam, a department spokeswoman, said the agency disagreed with the ruling and was evaluating its next steps. “This administration is committed to defending the religious liberty of all Americans and we look forward to doing so in court,” Ehrsam said in a statement. The lawsuit is among several that Democratic state attorneys general filed after the Republican Trump administration revealed the new rules on Oct. 6, which targeted the contraceptive mandate implemented as part of 2010’s Affordable Care Act, popularly known as Obamacare. The rules will let businesses or nonprofits lodge religious or moral objections to obtain an exemption from the law’s mandate that employers provide contraceptive coverage in health insurance with no co-payment. Conservative Christian activists and congressional Republicans praised the move, while reproductive rights advocates and Democrats criticized it. ",politicsNews,"December 21, 2017 "
